title,selftext,is_comment,score,flair
Is Ethereum worth investing in today?,"The Eth train is gone. 


* **Positive Crypto News:** The video highlights what is considered ""the biggest news of all time for crypto,"" mentioning major developments related to Trump's administration, XRP, and Ethereum.
* **Trump Administration's Executive Orders:** The video discusses two executive orders signed by President Trump that are seen as beneficial for the crypto community. The first is an order guaranteeing fair banking for all Americans, which prevents the denial of banking services based on political beliefs or lawful business practices. This is framed as a reversal of ""Operation Chokepoint 2.0"" from the Biden administration. The second order allows over 90 million American workers to access alternative assets, including digital assets like Bitcoin and Ethereum, in their 401k retirement accounts. The host claims this could open up $12 trillion in new potential money for the crypto market.
* **Market Analysis and Predictions:**
    * **Bitcoin:** The video notes a positive pump for Bitcoin following the news and discusses technical indicators, such as the 20-day EMA and the MACD, which suggest a potential bullish crossover and a push toward new all-time highs.
    * **Altcoins:** The host suggests it's ""altcoin's time now,"" anticipating a shift from Bitcoin dominance to altcoins like XRP and ETH.
* **XRP and Ripple's Case:** The video reports that the SEC vs. Ripple case is officially over, which is seen as a victory for Ripple and the crypto community. The host speculates that this resolution could pave the way for BlackRock to file for an iShares XRP ETF.
* **Ethereum Developments:**
    * **Devs' Commitment to Scaling:** The video praises Ethereum developers for committing to a roadmap that will scale the main chain to 10x its current capacity within the next year, aiming for 10,000 transactions per second.
    * **Institutional Interest:** The host notes a recent surge in institutional interest in Ethereum, citing a new treasury company, Fundamental Global Incorporated, that plans to raise $5 billion to buy ETH.
* **Other Crypto Assets:** The video also briefly covers other cryptocurrencies:
    * **Solana (SOL):** Noted for breaking out of a downtrend line, with a MACD bull cross expected soon.
    * **Pudgy Penguins (PANGU):** Mentioned as a meme coin with strong whale inflows and a new expansion into the Asia region.",True,-13,Discussion
BTC vs Spot ETF,"First, I promise this is not a promotion for FBTC!
So I've been researching BTC and FBTC and I am trying to find the upside FOR ME, in owning BTC outright.  The returns appear to mirror each other.  Keep in mind I myself don't care about holding BTC unless there is a big upside. I just want to add and diversify to my retirement portfolio.
 I'm thinking it would be nice to not have to worry about wallets and keys and transfers.  I have my entire stock and ETF portfolio at Fidelity and am thinking it just seems easier to buy the etf just like everything else I invest it.  Any thoughts on this minus expense ratio?

Thanks, even to the angry among us.",False,3,
BTC vs Spot ETF,Other than the expense ratio there is no downside to buying the ETF rather than just holding bitcoin yourself. Sometimes it's even more cost efficient to just buy the ETF because most crypto exchanges have insane purchase fees.,True,2,
BTC vs Spot ETF,For what you’re doing there’s no real downside to buying the ETF.,True,2,
BTC vs Spot ETF,"Unless you are using the BTC for transactions, it is cheaper to hold the ETF. The fees for purchasing will add up and the fee on a sale will add up. 
In theory the BTC to ETF price difference for gains should be the expense ration of the etf. 

Only downside that I really see is if there is a dip or sell off during a weekend or a big bounce….you miss that opportunity to buy or sell with ETF.",True,2,
"The Plan For India to Beat Tariffs ""may be"" Staking $577 Billion Worth of ETH to earn $26 Billion in Yields","How you ask - the Country's massive Gold Reserves! 

This idea is gaining a lot of traction in India recently, and is generating attention from the Gov't.

I doubt it will be that large ($577 Billion) - but the top Crypto voices in India are taking their idea mainstream.

Since ETH staking offers 4%-4.5% yields, India can stake $577 billion worth of ETH to earn $26 billion in yields, but how will the country accumulate such a large amount of Ethereum for staking purposes?

The country has a massive gold reserve worth $84.5 billion, which can be converted into ETH for staking. At the current ETH price of around $3,650, India can exchange its gold reserve for more than 23 million ETH tokens.",False,4,
"The Plan For India to Beat Tariffs ""may be"" Staking $577 Billion Worth of ETH to earn $26 Billion in Yields","The idea’s so detached from reality, I had to double-check I wasn’t in an XRP forum.

Step one: Magically summon $577 billion in ETH.

Step two: Make India, a country culturally obsessed with gold, decide to sell it.

Step three: Convince one of the most anti-crypto governments, which officially calls crypto gambling, to sink hundreds of billions into it.

Sure, sounds totally realistic.",True,10,
"The Plan For India to Beat Tariffs ""may be"" Staking $577 Billion Worth of ETH to earn $26 Billion in Yields","Sell my house, to pay for the EMI of my car kinda comment.",True,5,
"The Plan For India to Beat Tariffs ""may be"" Staking $577 Billion Worth of ETH to earn $26 Billion in Yields",There isn't 577bn worth of eth,True,2,
"The Plan For India to Beat Tariffs ""may be"" Staking $577 Billion Worth of ETH to earn $26 Billion in Yields",How do you convert 84 billion dollars worth of gold into 577 billions dollars worth of Eth?,True,2,
"The Plan For India to Beat Tariffs ""may be"" Staking $577 Billion Worth of ETH to earn $26 Billion in Yields",They will ban it next week.,True,1,
"The Plan For India to Beat Tariffs ""may be"" Staking $577 Billion Worth of ETH to earn $26 Billion in Yields",Let’s go!!,True,1,
"The Plan For India to Beat Tariffs ""may be"" Staking $577 Billion Worth of ETH to earn $26 Billion in Yields","I generally just hit “do not recommend” on any channel pushing anything dumb like that so it’s pretty rare for me to come across it unless it’s more realistic people calling it out - there are some other brain dead narratives that make the rounds as well like ‘only 1000 people will be able to hold XRP and the rest will be priced out” - or ‘no utilty is actually priced in yet - when things go to utilty it is only up forever - SUPER CYCLE NEVER DOWN AGAIN” 🤦🏻‍♀️ 
Just feels like bad actors farming clicks and spreading false misinformation - there is a lot of false information used to discredit XRP as well though - good info out there if you curate your sources though!

Really feels like those people are just trying to farm clicks and sell false expectations -",True,1,
"The Plan For India to Beat Tariffs ""may be"" Staking $577 Billion Worth of ETH to earn $26 Billion in Yields","How does this help beat tariffs? Seriously? I think you need to think with more clarity. 

It helps the government make money, but it does not pay the tariffs which US importers have to pay. It does not help Indian businesses make up for sale losses.",True,1,
message signing function,"Hello. Been staking ada on Revolut (I know not the best idea), but my wallet is intitaled to Glacier drop but cant find the signature to sign off on the transfer, any suggestions? Many thanks. ",False,1,FUNDAMENTALS
My planned crypto portfolio – looking for feedback,"Hey everyone,

I’m putting together a simple long-term crypto portfolio, weighted by current market capitalization.  
Here’s the breakdown:

* **BTC** – 72.0%
* **ETH** – 15%
* **XRP** – 6%
* **BNB** – 3%
* **SOL** – 3%
* **TRX** – 1.0%

The idea is to mirror the market cap distribution among these top coins. I’ll rebalance periodically — if market caps shift significantly, the allocation will adjust accordingly.

The goal is to keep it simple, track the market as a whole, and avoid overexposure to smaller, riskier coins, while still having some exposure to altcoins beyond BTC and ETH.

What do you think about this approach? Any pitfalls I might be missing?",False,4,DISCUSSION
My planned crypto portfolio – looking for feedback,"I would drop the XRP, I think it will underperform the others.",True,5,DISCUSSION
My planned crypto portfolio – looking for feedback,Looks good,True,2,DISCUSSION
My planned crypto portfolio – looking for feedback,I’d switch SOL and XRP,True,2,DISCUSSION
My planned crypto portfolio – looking for feedback,"A safe route for me would be: BTC, ETH, LINK. 

BTC is one of a kind and will always be the grand daddy.

LINK - defi and now RWA would collapse without LINK and no other project comes close to LINK when it comes to oracle.

ETH - some might argue there are stronger L1’s out there, which there might be, but follow the smart money.

My portfolio consists of several other cryptos besides BTC/ETH/LINK. This is what I’d recommend to someone that’s looking for the safest low-risk strategy.",True,2,DISCUSSION
My planned crypto portfolio – looking for feedback,Idk how much your total capital is but Sol deserves more than 3%. It will outperform XRP 1000%,True,1,DISCUSSION
My planned crypto portfolio – looking for feedback,"Only the top 2.  Also Ideally invest outside of crypto.  I’d do:

- VOO: 50%
- QQQ: 25%
- BTC: 20%
- ETH: 5%",True,1,DISCUSSION
My planned crypto portfolio – looking for feedback,Get more of sol and ETH if u need more multipliers,True,1,DISCUSSION
My planned crypto portfolio – looking for feedback,Are you holding through the bear market that is months away?,True,1,DISCUSSION
My planned crypto portfolio – looking for feedback,"I think this is a good idea : diversified and effectively your own lilttle ETF made up of some of the top performers… personally I don’t plan to round trip any of my crypto but if you plan to hold for a very long time you could do very well (my plan is to scale out profits, and then buy back in during the depths of bear markets)",True,1,DISCUSSION
My planned crypto portfolio – looking for feedback,"That portfolio looks solid but it is missing a key piece like $NEURAL. With its AI tech and strong utility, it could level up the whole mix.",True,1,DISCUSSION
My planned crypto portfolio – looking for feedback,"Some projects focus too much on branding before they have a product. $WHITENET is doing the opposite: build first, brand second. That’s the way to go.",True,1,DISCUSSION
August vibes: not as hyped as July—what that means for daily trades vs holders,"Yo crew, July pumped—ETH popped \~48%, Bitcoin not far behind. Mass mania. But August is a different story: seasonal lull, profit-taking, thin liquidity, higher volatility.[Weiss Ratings](https://weissratings.com/en/weiss-crypto-daily/why-bitcoin-s-august-chill-might-spark-a-red-hot-q4?utm_source=chatgpt.com)[Bitget](https://www.bitget.com/news/detail/12560604889678?utm_source=chatgpt.com)

**Proof’s in the data:** BTC historically dips in August (\~–7.5% avg), with median around –7.5%.[Weiss Ratings](https://weissratings.com/en/weiss-crypto-daily/why-bitcoin-s-august-chill-might-spark-a-red-hot-q4?utm_source=chatgpt.com)[AInvest](https://www.ainvest.com/news/bitcoin-news-today-bitcoin-faces-seasonal-weakness-august-september-7-5-average-historical-drop-2508/?utm_source=chatgpt.com) ETH is seeing range-bound candles, no strong trends.[Investing.com](https://www.investing.com/crypto/ethereum/historical-data?utm_source=chatgpt.com)

**Trade tip:**

* Day-trading? Expect choppy. Pause, wait for clear patterns.
* Long-term HODLers? Could be your “buy” moment—capitalizing on lower noise.",False,0,
Has anyone here invested in Karrat Coin? What has been your experience so far?,"I've been hearing a lot about Karrat Coin lately and I'm curious to know more about it. Can anyone here share their thoughts on this project? What makes Karrat unique? Is it a good investment opportunity?

This article though had some potential points to follow on Karrat crypto.

From what I've gathered, Karrat Coin seems to be a relatively new project that's gaining traction in the crypto space. But I'd love to hear from people who have more knowledge about it.

",False,0,TECHNICALS
Has anyone here invested in Karrat Coin? What has been your experience so far?,Scam,True,3,TECHNICALS
Does Tokenizing the Newport landfill makes sense?,"James Howells, an IT worker from South Wales, had used his laptop to 'mine' \~ 8000 units of digital Bitcoin currency in 2009. He was the one of only 5 miners in 2009. In 2010, the Dell XPS N1710 broke after he spilt lemonade on it, so he dismantled the computer  for parts, kept the drive in a desk drawer and later binned it.

That hardrive is now sitting at Newport landfill somewhere buried under 25,000 cubic meters of waste and earth"", weighing approximately 110,000–200,000 tonnes. To give you the scale, it could be anywhere beneath an area of rubbish the size of a football pitch.

Now, as per the latest news, the landfill site is set to permanently close in the 2025/26 financial year. The landfill has been in operation since the early 2000s and is nearing the end of its lifespan, hence the council is planning its closure. It will mean a loss of a predicted sum of just shy of £1m for Newport city council due to loss of revenes from disposal of commercial waste.

I feel that this presents a perfect opportunity to tokenize this landfill. The land can be leased for 5 years.  
Now before tokenizing, would the hardrive be intact today or would have been galvanized ?  
Howells believes the drive is still functional due to its protective casing and the anti-corrosive cobalt layer coating the glass disk.

Britian isn't Dubai or Japan, so Tokenizing direct 'landfill' might be difficult.

So, instead, we tokenized fund that will hold the lease to the landfill for next 5 years.  
That means:  
\- SPVs.  
\- Legal wrappers.  
\- Some Regulatory layers.  
\- Miscellaneous costs

Setting up Tokenomics

Total tokens - 21 Million  
10% tokens held by James Howells and the Fund.  
Out of the remaining 90% tokens, half i.e. 9.45 million tokens sold over public market at $1.05 thus netting $10 mln to take care of the operational cost.  
We can add vesting schedules if we want to.  
The remaining 50% tokens will be sold if Bitcoin is found  
in the form of Bitcoin treasury allocation.

The 8000 Bitcoin is valued at \~ $950 mln today.

If you consider a rise of even 2x in Bitcoin from here by next year then that's 20000% returns

Using $10 mln raised funds

1. Use of artificial intelligence using a mechanical arm to scan waste to identify the hard drive
2. Using drones, and Boston Dynamics robotic dogs for security, 
3. 3.Recruiting an AI specialist and an environmental team to the project.
4. Experts in landfill excavation, and a data recovery advisor.

Or, develop a community-owned mining facility on the landfill site. The facility would use solar or wind power and generate power revenues.

What if the hardrive wasn't there at the first place?

I think that won't matter considering the possibilities of juicing revenue out of this.

To start with, We can have prediction markets on 'Polymarket' today where a rolling 3-6 monthly market can be run.

I can myself launch 'dCdS' risk markets around excavation (insurance derivatives) on my live product 'Autonomint'.

There could be 'Media + Story Monetization' as This is a Netflix special waiting to happen  
Share revenue from:  
\-> Netflix/YouTube/Prime rights  
\-> Merch sales (“8000BTC Lost Club”)  
\-> Podcast sponsorships

Time locked token vaults  
Let’s say there’s an 5-year chance this pays off so build a lock-to-earn model:  
\-> Stake tokens in a vault that matures only in 2030.  
\-> The earlier you lock, the bigger your cut of the find (or prediction market winnings).  
\-> Adds long-term speculative conviction.",False,0,STRATEGY
For short term Bitcoin or Solana?,"If someone's intention is to make profit in short time then he/she should invest in Bitcoin or in Solana? Bitcoin is already at high value but it's the most important coin, however we can't neglect the fact that Solana has also performed well in this cycle. I know the meme coin hype is almost over now but can Solana still be a better investment option for short time or Bitcoin is better even for short term.",False,0,Discussion
For short term Bitcoin or Solana?,Both are good tbf,True,1,Discussion
Weekly ADA Updates,"Next week is a pivotal test of breakout strength. A weekly close above $0.823 would validate a bullish reversal; otherwise, expect a potential short-term correction or consolidation phase around $0.75–$0.70.",False,1,TECHNICALS
Weekly ADA Updates,"Nice, thanks for info.",True,1,TECHNICALS
Is SOL worth investing in?,"I've been interested in crypto for years but still, I know very little about it and how it works. But I've been observing SOLANA now for maybe about 3 years and saw it just keep increasing in price. So I was thinking maybe I should put money on it and leave it for a couple of years and see how it go? What do you guys think? Is Sol worth putting money on and would it keep increasing in price?",False,21,Discussion
Is SOL worth investing in?,Do you always miss the dip before looking for  “worth”?,True,12,Discussion
Is SOL worth investing in?,"If your question is: Is sol a shit coin then no, it is decent enough to be considered a value add for the space.

If your question is: does sol outcompete it's rivals?
That is much less certain given its weakness in several key criteria compared to say ethereum which despite the haters never really lost the trust of institutions and is only now getting real adoption by the wider financial sector.

I don't think Sol will fail, but it does not appeal to big money very much, it's basically retail ether and that by design has a much more limited Cashflow potential.",True,9,Discussion
Is SOL worth investing in?,id put the grandmas house on it.,True,7,Discussion
Is SOL worth investing in?,Absolutely not. Its a scam.,True,3,Discussion
Is SOL worth investing in?,"Just dca in sol and eth, the rung is going to be huge",True,6,Discussion
Is SOL worth investing in?,Yes.,True,5,Discussion
Is SOL worth investing in?,"When Eth has first mover advantage, most of the development, institutional adoption and market cap...?",True,4,Discussion
Is SOL worth investing in?,Go for it!,True,2,Discussion
Is SOL worth investing in?,"SOL will ""eat"" current ATH in a next few months. Just make sure you covert all of it in USDT by the end of the year. IMO that is when we can see start of next bear market.",True,4,Discussion
Is SOL worth investing in?,No. Go with ether.,True,3,Discussion
Is SOL worth investing in?,No,True,4,Discussion
Is SOL worth investing in?,Check SOL/ETH and ETH/BTC charts. There is your answer.,True,3,Discussion
Is SOL worth investing in?,"There is no more narrative in Solana. It was a good coin only because of memecoins, but now memecoins do not have hype anymore.",True,3,Discussion
Is SOL worth investing in?,"Real talk yeah there's a lot going on in Solana that isn't discussed here

It's not just meme coins",True,2,Discussion
Is SOL worth investing in?,"If you’ve been eyeing sol for 3 years now and still believe in it, putting in some money and letting it sit sounds good. I hold some on Nexo so it earns yield while I wait, might be worth checking out if you're planning to HODL anyway.",True,1,Discussion
Is SOL worth investing in?,time to go balls deep with 20x leverage. thanks me later.,True,1,Discussion
Is SOL worth investing in?,Absolutely especially staking it too,True,1,Discussion
Is SOL worth investing in?,"SOL, SUI, & AIOZ over ETH for me.  
However, I hodl all.",True,1,Discussion
Is SOL worth investing in?,SOL will keep going up. It is the majority of my portfolio.,True,1,Discussion
Is SOL worth investing in?,Hbar and its tokens are this cycle’s Sol,True,1,Discussion
Is SOL worth investing in?,"There is only one crypto that has shown the test of time and has immutability, scarcity, and is real digital capital.

B T C

All others (so far) are inferior and really no better than fiat currency.   You can make a case for ETH being valuable for it's network and contracting stuff, but that is still TBD, in my opinion.

Go look at the appreciation of BTC and you can see your answer.   

Not Financial Advice.",True,1,Discussion
Is SOL worth investing in?,Never. Its a scam meme space.,True,1,Discussion
Is SOL worth investing in?,"Not !!
Never",True,0,Discussion
Is SOL worth investing in?,Kaspa will make sol and eth obsolete soon,True,0,Discussion
Is SOL worth investing in?,Solana is the fastest and cheapest network in crypto and earns $2 million a day in fees. It’s the only legitimate competitor to Ethereum.,True,-2,Discussion
Is SOL worth investing in?,You're late to the game on SOL it blossomed early. better off investing in different alts.,True,-1,Discussion
Is SOL worth investing in?,"Have you not learned that alts bleed against Bitcoin? Putting money on it and leaving it for a couple of years and see how it goes is not a great idea. It's also very late in the cycle now, you DO NOT want to hold altcoins through the bear market next year",True,0,Discussion
Is SOL worth investing in?,"A crypto miner is. Buy something down, like riot platforms… not something that is up/you missed the dip on.",True,0,Discussion
Is SOL worth investing in?,Use the DCA strategy will work for next 3 years.,True,0,Discussion
Is SOL worth investing in?,XRP it is 👌,True,0,Discussion
Is SOL worth investing in?,Looking for a SOL gem? You might want to check $NEURAL. It is multi-chain with ETH and comes with strong AI tech backing it.,True,0,Discussion
Should I jump out of options to ethereum?,"I’ve been trading options for a while, mostly focusing on large-cap stocks and ETFs. Lately it feels like the opportunities are drying up. Implied volatility gets crushed quickly, price action has been choppy, and premiums often do not feel worth the risk. Maybe I am just feeling a bit burned out.

At the same time, Ethereum has been catching my attention again. There seems to be some momentum building, and I still believe in its long-term potential. I am seriously considering shifting part or all of my options capital into ETH and holding it through the next few years.",False,5,Discussion
Should I jump out of options to ethereum?,Should of jump out 6 months ago though.,True,3,Discussion
Should I jump out of options to ethereum?,Yes,True,2,Discussion
Should I jump out of options to ethereum?,"What are trying to accomplish? I’m assuming you just want to trade active markets, in which case go where the money isn’t a headache. Trading isn’t a one trick pony. You can literally do both, either, or none

Also you might want to consider the overall market as to why you’re having a harder time. Switch it up - look for rallies to sell, by buying out options. SPX options moving 1000% regularly if you’re on top of it",True,1,Discussion
Should I jump out of options to ethereum?,Yeah,True,1,Discussion
Token RunBit New GEM?,"Guys, I found this RNB/USDC crypto and would like to open this discussion to help me decide whether or not to participate in this project.

This is the token's website
www.runbit.world

They are distributing tokens to everyone who submits their workouts in the official group. And in the next phases, they will launch NFTs of medals and trophies for physical challenges, athlete rankings, integration with running apps, and support for low-income athletes.

I confess that the idea appealed to me because I run.

Looking at the proposal, would you join this project?

X.com/RunBitOfficial Profile",False,2,
Issues with further Crypto regulation and integration,"Correct me if I’m wrong, but isn’t the point of cryptocurrencies to avoid government interference in our capital? Today we continue to see more and more of a push for regulation and integration with existing legacy systems even though that directly contradicts the original philosophy of the cryptocurrency community. For example, under the “GENIUS Act”, we have further regulation on stablecoins and the assets that back them. Why? If the dollar fails, if gold fails, then let them. Crypto will survive. Am I completely wrong here? Because I feel as though we ought to be wary of governments “friendly” to crypto, as that may come to bite us later. ",False,8,DISCUSSION
Issues with further Crypto regulation and integration,"people dont really care about the initial decentralisation purpose of crypto, they just want headlines and hope they will pump their bags so they can get rich fast.

p/s: I got downvoted badly for saying similar thing when they proposed the crypto regulation",True,4,DISCUSSION
Issues with further Crypto regulation and integration,Exactly why btc & ada are more than 60% of my portfolio,True,2,DISCUSSION
