title,selftext,is_comment,score,flair
Where,Where are we in the current cycle do you reckon? How many months do you believe we have until we reach peak and need to begin selling? I have been in the crypto game now for two months and am attempting to understand this cycle.,False,2,
Where,"Nobody knows, good luck",True,1,
ETH Exit Strategy,"Hi guys, I am new to crypto and have consistently bought ETH since March 2025. Currently I have nearly 2 ETH with avg entry around 2,200.

Since ETH is about to break its ATH this year, should I sell for maximum profit or wait till March 2026 to make it count as long term investment for better tax percentage?

What would your exit strategy be if you were in my situation?

Thanks.",False,0,Sentiment
ETH Exit Strategy,"No body knows. It's the truth.

Personally I would wait till March 2026 because ETH rallies last longer than others.",True,1,Sentiment
when to begin rotating out of ETH,"My portfolio is 80% ETH right now.

In the coming days I think I will begin rotating into alts.

Thoughts?",False,3,STRATEGY
when to begin rotating out of ETH,why? ETH isn't even at its ATH yet.,True,1,STRATEGY
when to begin rotating out of ETH,"Alts are bleeding, its not alt season its Eth season rn

[https://www.youtube.com/watch?v=fwYb6AEUb2Q](https://www.youtube.com/watch?v=fwYb6AEUb2Q)",True,1,STRATEGY
when to begin rotating out of ETH,"I dunno I kept trying to, but paid dearly.",True,1,STRATEGY
when to begin rotating out of ETH,Not even close. Tom Lee is just getting started.,True,1,STRATEGY
when to begin rotating out of ETH,"Well beyond the flippening. There is no reason BTC should be #1, it has zero properties that make it worth anything near what ETH should be worth.",True,1,STRATEGY
News question!,We all know that news influences the markets but where do you see the news that affect crypto is it just like forex factory and cnbc or is it diffrent?,False,1,DISCUSSION
News question!,Any macro / FX / politics. You just follow relevant news portals that's all,True,1,DISCUSSION
Ethereum Close to All-Time Highs — Altcoin Season Loading?,"Hey everyone,

Over the last few days, the charts have been buzzing. Ethereum is now pushing towards the $4,000 mark, just a few hundred dollars shy of its all-time highs. If ETH breaks through, history tells us that altcoin season could follow quickly.

Here’s what I’m watching:

Bitcoin holding strong above $150K, stability is a green light for alt growth.

Ethereum only ~$500 away from ATH, breakout potential is huge.

Altcoins like XRP starting to show signs of life, but the real momentum is yet to come.

	
REM Token (RWA-focused microcap), A play on the tokenization of real-world assets, available on MEXC.

RWA sector as a whole is booming,tokenized real estate, gold, and commodities are gaining traction, especially with increasing regulatory clarity (even the US is opening up crypto for retirement plans).

Curious to know what everyone here thinks:
Will ETH break ATH this month?
Which alts are you loading up on before altseason?",False,1,DISCUSSION
Ethereum Close to All-Time Highs — Altcoin Season Loading?,"Historically altseason doesn’t start just because ETH tags $4k—it kicks off when ETH/BTC breaks out and BTC dominance rolls over. If ETH makes a clean ATH on strong spot/stablecoin inflows and L2 activity, rotation usually spills into high-beta L1s and DeFi next. Until those signals print, expect selective pumps rather than a full-on altseason. I’m watching the ETH/BTC weekly close and BTC.D—what are you tracking?",True,1,DISCUSSION
Ethereum Close to All-Time Highs — Altcoin Season Loading?,Still waiting for bitcoin dominance to convincingly drop below 60 and subsequently 55,True,1,DISCUSSION
Ethereum Close to All-Time Highs — Altcoin Season Loading?,"Alt season will be at the end of the year. Pull back in September with some chop, then the alts will finally bottom out. Then BTC and ETH head for blow off tops for the end of year, and finally rotation into alts. Unfortunately, there will be a catch for alt season because there are so many of them now - not all will do well because of the shear number of them, plus retail has not really entered the market and probably will not like 2021. People are on hard times and do not have the money to gamble.",True,1,DISCUSSION
Ethereum Close to All-Time Highs — Altcoin Season Loading?,Bitcoin 150k when?,True,1,DISCUSSION
Lost 90% on TRUMP meme coin — should I HODL or cut my losses,"
Back in Jan 2025, I invested ₹10k ($120) in TRUMP meme coin at around $60–$70 each (about 2 coins). Now it’s sitting at ~$9 — worth less than $18 total.

With US election hype possible later this year but Trump facing negative news globally, I’m wondering: sell now for pennies or hold in hope of a $30–$60 rebound?

 Anyone else holding TRUMP? What’s your plan?


What would you do in my place?

1. Sell now — cut losses
2. Hold until elections
3. Hold long-term (2026+)
",False,0,ANALYSIS
Lost 90% on TRUMP meme coin — should I HODL or cut my losses,You got scammed and you should know it by now,True,15,ANALYSIS
Lost 90% on TRUMP meme coin — should I HODL or cut my losses,Just paid for a class,True,5,ANALYSIS
Lost 90% on TRUMP meme coin — should I HODL or cut my losses,Buy golden sneakers from Trump too.,True,4,ANALYSIS
Lost 90% on TRUMP meme coin — should I HODL or cut my losses,Double down on margin and maxing out credit cards is an option too!,True,3,ANALYSIS
Lost 90% on TRUMP meme coin — should I HODL or cut my losses,"What do you mean by ""hold until elections"".  Presidents can only have 2 terms.  What elections are you speaking of?",True,2,ANALYSIS
Lost 90% on TRUMP meme coin — should I HODL or cut my losses,I dumped mine...I spent a 100 too...so I played day trading it till it was gone but it did improve a little and then tanked out again. There's no harm letting it roll and see what happens...as stranger things have happened 🤷🏼‍♂️,True,1,ANALYSIS
Lost 90% on TRUMP meme coin — should I HODL or cut my losses,Take it as a lesson not to buy shitcoins.,True,1,ANALYSIS
Lost 90% on TRUMP meme coin — should I HODL or cut my losses,"Buy more and get your ave down, Dca.",True,1,ANALYSIS
Lost 90% on TRUMP meme coin — should I HODL or cut my losses,hold until it's worth 0 dollars :),True,1,ANALYSIS
Lost 90% on TRUMP meme coin — should I HODL or cut my losses,"Honestly it will probably pump again. Although I highly doubt it will reach ATH.

Do not buy meme coins. They are not worth it. I swear if I had even a penny every time I’ve typed that…",True,1,ANALYSIS
Lost 90% on TRUMP meme coin — should I HODL or cut my losses,"Lol
Get wrekt bro",True,1,ANALYSIS
Lost 90% on TRUMP meme coin — should I HODL or cut my losses,I'm pretty sure that's the point. Losses.,True,1,ANALYSIS
Lost 90% on TRUMP meme coin — should I HODL or cut my losses,"You decide. In the states, in tradfi people will wait till December to make decisions for tax purposes. You have to factor that in.",True,1,ANALYSIS
Lost 90% on TRUMP meme coin — should I HODL or cut my losses,Buy more at cheaper price,True,1,ANALYSIS
Lost 90% on TRUMP meme coin — should I HODL or cut my losses,"hold to $0.01

Let it be a lasting lesson, like herpes",True,1,ANALYSIS
Lost 90% on TRUMP meme coin — should I HODL or cut my losses,I got it.. i should sell accept the what I'm left with,True,1,ANALYSIS
Lost 90% on TRUMP meme coin — should I HODL or cut my losses,i'd hold until you can at least get your initial investment back,True,-1,ANALYSIS
"After 5 Years in Crypto Trading, I Finally ""Made It"" - Here's What Actually Worked","I started trading crypto in 2018. Like many, I got in with zero experience, thinking I’d get rich fast. Spoiler: I didn’t.

Bought TRX, XRP, and a bunch of random altcoins. Lost $2,700 in a few months. Then I tried margin trading (big mistake), got liquidated, and was left staring at an empty account. Honestly, I almost quit.

In 2019, I decided to stop gambling and start learning. I studied charts, watched real traders, read books, and backtested strategies. I didn’t trade real money for a while—just practiced and journaled everything.

By 2020, I was finally making small profits. Took only setups I trusted, avoided hype, and managed risk properly. Made around $4,800 on a $3K account. Nothing crazy, but it felt earned.

2021 bull run? I was ready. I grew my account to over $43K trading ETH, SOL, and a few strong alts. But I got cocky, messed with leverage again, and gave back a chunk. That lesson hurt, but it stuck.

2022 was survival mode. I traded less, avoided trying to “buy the dip,” and focused on capital preservation. Profits were small, but I didn’t lose.

From 2023 to now, I’ve kept it boring: 1% risk per trade, only 2–3 reliable setups, and strict journaling. I don’t trade every day. I don’t chase pumps. I just stick to what works.

In 2024, I crossed $100K in my trading account. No moonshots. Just consistency over time.

TL;DR

Lost money in 2018 (like most beginners) Started learning & tracking everything in 2019 Profitable by 2020, stayed consistent Bull run helped, but greed punished me in 2021 Focused on capital protection in 2022 2023–2025: steady growth, no drama Finally passed $100K in 2024 Biggest Lessons:

You won’t get rich overnight. Risk management > everything. You don’t need to trade every day. Journaling your trades = free edge. Survive long enough, and your edge will show up. Happy to answer questions if anyone’s stuck in the early phase like I was. Stay in the game.",False,26,Sentiment
"After 5 Years in Crypto Trading, I Finally ""Made It"" - Here's What Actually Worked","Out of all the indicators, which one's do you think are most reliable?",True,3,Sentiment
"After 5 Years in Crypto Trading, I Finally ""Made It"" - Here's What Actually Worked",Will also share some resources you used to learn and still using constantly? This is inspiring to read.,True,2,Sentiment
"After 5 Years in Crypto Trading, I Finally ""Made It"" - Here's What Actually Worked","Relatable journey. The big shift for me was treating it like probability management, not prediction: fixed risk per trade (≤1R), fewer setups, ruthless journaling to kill FOMO/revenge trades. Investing side is just boring DCA into BTC/ETH; trading side only triggers when a backtested setup offers 2R+ expectancy. Turns out edge + risk + discipline >>> coin picking.",True,2,Sentiment
"After 5 Years in Crypto Trading, I Finally ""Made It"" - Here's What Actually Worked",Inspirational 🫡,True,1,Sentiment
"After 5 Years in Crypto Trading, I Finally ""Made It"" - Here's What Actually Worked",Congrats! That has gotta feel good.,True,1,Sentiment
"After 5 Years in Crypto Trading, I Finally ""Made It"" - Here's What Actually Worked",I just held and traded a bit on Deribit in 2018/2019. I fee lucky to get in as early as 2017. Idk how I would trade in today’s markets.,True,1,Sentiment
"After 5 Years in Crypto Trading, I Finally ""Made It"" - Here's What Actually Worked",I passed 100k thanks to XPR Network,True,1,Sentiment
"After 5 Years in Crypto Trading, I Finally ""Made It"" - Here's What Actually Worked",Have you compared to what you’d have if you had just DCA’d the same amount of money into Bitcoin over that time period?,True,1,Sentiment
"After 5 Years in Crypto Trading, I Finally ""Made It"" - Here's What Actually Worked",I notice you said nothing about 2025. How has this year treated you so far? I take it you just trade spot? What sort of time frames?,True,1,Sentiment
"After 5 Years in Crypto Trading, I Finally ""Made It"" - Here's What Actually Worked",Can you recommend any of the sources that helped you learn?,True,1,Sentiment
"After 5 Years in Crypto Trading, I Finally ""Made It"" - Here's What Actually Worked","How do you manage to keep discipline to not overbet?
I've been trading more than ten years and I keep blowing accounts because of too much risk...",True,1,Sentiment
"After 5 Years in Crypto Trading, I Finally ""Made It"" - Here's What Actually Worked",That’s quite a grind. You didn’t get lucky by FOMOing in a meme at the right time. This is the best year for crypto imo,True,1,Sentiment
"After 5 Years in Crypto Trading, I Finally ""Made It"" - Here's What Actually Worked","Do you have a cold wallet? If so, What brand?",True,0,Sentiment
"HBAR, XLM, ETH - Buy now?","Hi, I am just wondering if now is the right time to buy HBAR, XLM, and ETH, or if we are expecting a dip below current prices in the near future? Cheers.",False,10,Discussion
"HBAR, XLM, ETH - Buy now?",Nobody knows.  DCA,True,5,Discussion
"HBAR, XLM, ETH - Buy now?","If you want to trade them with leveraged accounts, it is impossible to predict. If you want to invest, I personally think ETH is too high, while HBAR and XLM are alright. But never go all in, divide your capital so that if the price drops you can still buy more.",True,3,Discussion
"HBAR, XLM, ETH - Buy now?","No one knows.

ETH by far is the safest. Hbar and xlm are mere gambles. They could pay off well, or leave you in regret. 

I’m a supporter of hbar. XLM not so much, but that’s simply because I have chosen not to research it.",True,1,Discussion
"HBAR, XLM, ETH - Buy now?",Algorand,True,0,Discussion
"HBAR, XLM, ETH - Buy now?","Bro ETH is at near ATH right now. Are you one of those who buy high, sell low?",True,0,Discussion
"HBAR, XLM, ETH - Buy now?",Algorand,True,0,Discussion
"HBAR, XLM, ETH - Buy now?",Menero cheers,True,-1,Discussion
"HBAR, XLM, ETH - Buy now?",Don’t sleep on LYBRA FINANCE on crypto. Com,True,-1,Discussion
Cronos long term,"Does anybody hold $CRO I got in at .13
 
I have around 1,400 and the way $ETH is moving, i have high hopes for long term benefits

I'm so broke the 60% return I got on this coin the past month was like 30 bucks lol....

Am i dumb?

Give me a hundred grand please

I give up

fuck it

i dont give up i'm just like damn.

 Friday while I was at work, i set up a strike option 10x leverage with 100 contracts and watched in disbelief how I not only placed a real trade (thinking i was on demo) but was on 5 minutes and it was the only 5 minutes $ETH dropped.

You can tell how experienced I am.

I'm deep into the game yall dont even know.

The reason you never heard of me is cuz im kinda lowkey and nonchalant. 

You feel.

But really, would this be a good investment? Anybody out there with some experience let me know?",False,4,
Cronos long term,What top exchanges have listed this?,True,1,
Cronos long term,"I like CRO and am doing very well with it, in the green and it’s good for passive income, in addition to growth.",True,1,
Cronos long term,"Been holding since .05 and plan on holding long term.  Not the best exchange or network but the hope is that in time they'll get their shit together, fix their tokenomics and make the Cronos chain a more viable chain.",True,1,
Cronos long term,I have read a bunch of stories that Whales have been accumulating mass amounts of this. You may be on to something.,True,1,
"Ada, how do you see this going …","Does anyone hold a bag of ADA, what do you intend doing with it ? 
I’ve held a bag for 6 months now, it doesn’t seem to do anything, it climb’s to my DCA then drops sharply, to me it feels like it’s going nowhere and i should off load it, I did read somewhere a week ago it was heading to $3 and was followed closely the 2020 run to three dollars so I held off selling at a loss, what’s your thoughts, do you think it still has potential or are you looking to offload. 
",False,19,Support-Open
"Ada, how do you see this going …",i just hold.,True,15,Support-Open
"Ada, how do you see this going …","ADA and xrp holders seem same to me, xrp ended up paying off for some so maybe it will for you",True,3,Support-Open
"Ada, how do you see this going …","4 ADA guys commented so far and noo ne has any clue or insightful info to provide except ""Hodl"".. these kids have no clue wtf goin on or what they ""hodl-ing""",True,7,Support-Open
"Ada, how do you see this going …","From what i observe ADA’s been slow these days, but its fundamentals are still solid. If you believe in the long term vision, then your patience might pay off, if not, there’s no harm in reallocating to something with stronger momentum right now.",True,4,Support-Open
"Ada, how do you see this going …",It should do a 5 to 7x in the next few months,True,1,Support-Open
"Ada, how do you see this going …",If u sell just don't sell at a loss bro,True,2,Support-Open
"Ada, how do you see this going …",Wait,True,3,Support-Open
"Ada, how do you see this going …","ADA is boring, until it isn’t. But got damn is it boring lol",True,3,Support-Open
"Ada, how do you see this going …","Dino coin, if it gets a pump at all sell out and buy something better on next dip.",True,2,Support-Open
"Ada, how do you see this going …",Ada know,True,1,Support-Open
"Ada, how do you see this going …",I just hold and stake it.,True,1,Support-Open
"Ada, how do you see this going …",I got tired of the bag so moved it to btc lol. Maybe I’ll get back in when my timing/research is better.,True,1,Support-Open
"Ada, how do you see this going …",What platform offers the highest staking %age for ADA?,True,1,Support-Open
"Ada, how do you see this going …","6 months?

Most people into ADA are looking at long term, although I'd say ADA will ""move"" if the bull run happens in full force and ETH hits certain targets and the money rotates to relatively smaller caps.

If I was buying anything just for the bull run (NFA) I would be looking at smaller caps at this point. I suspect this run and perhaps the next one are still in the FOMO and narrative phase of crypto, not the tech and utility phase...yet. People just lose their mind in the euphoric phase and throw money at narratives. That's ok. I'm ready.

Ironically, Bitcoin is now mostly cherished for its utility (store of value) so there's that.

As institutions start making use of chains for various utility, the secure trusted chains will become very appealing. ADA's integration with BTC is interesting, and could become a competitor for layer two purposes.  Both very secure. 

but that's just me. NOT financial advice.",True,1,Support-Open
"Ada, how do you see this going …","No offense, but You ADA guys got anything upcoming in the pipeline thats going be the catalyst for the price that your waiting/hoping for, or is this coin just a never ending staking pyramid scheme?",True,1,Support-Open
"Ada, how do you see this going …",Charles is a massive twat...,True,1,Support-Open
"Ada, how do you see this going …","I don't hold it because I dont understand it
Btc and hype I get, but why are you guys buying all those weird name cryptos? Xrp Ada hbar, wtf you guys buying those for

But what do I know 🤷‍♂️",True,0,Support-Open
"Ada, how do you see this going …",Anyway we dont seem to be getting anywhere and Im not exactly getting smarter or hyped here on ADA so Imma bounce but hope it works out for you guys n u get rewarded,True,0,Support-Open
"Ada, how do you see this going …",Moon 🌑,True,0,Support-Open
Brand new to crypto,"Hi , long time reader about crypto, so I’d like to think I understand a tiny little bit 🤏 about it . I have never purchased any but I  want to invest some money . What are the recommended platforms to buy from? Was considering Binance or Coinbase . I read before not to buy from Revolut as you don’t actually own the crypto , is this true?

Also would you consider getting a cold wallet straight away ? 

Thanks ",False,1,
Brand new to crypto,"If you are in US - Coinbase 
Outside US - Binance
Anything else is not worth it. They are best in class.",True,2,
Brand new to crypto,"I guess it depends a bit on your country. But yes, Binance and Coinbase are generally good choices. Kraken also in my opinion. Look at the options they propose for funding your accounts, and which ones are available to you with the lowest fees.

When doing transactions on the crypto exchanges, pay attention to the fees. Coinbase will have high fees, but Coinbase Advanced will have low fees. Kraken will have high fees, but Kraken Pro will have low fees.

With Revolut, you won't own the cryptos for sure, but you also won't with any other crypto exchange unless you transfer to a cold wallet. I think the problem with Revolut is mainly the very high fees they propose. You can however look at RevolutX (https://exchange.revolut.com) if its available in your country, they have competitive fees and they can be a nice alternative to the crypto exchanges mentioned above. Just don't use the Revolut banking app.

I would first play a bit with the exchanges before buying a cold wallet. Wait 1 or 2 months, and if you really want to continue invest in a cold wallet then.",True,1,
Brand new to crypto,Try coinbase is never had a problem sending or receiving my money buy inspect insp for an easy double your money or much more your welcome,True,1,
Brand new to crypto,"With Coinbase or Binance you don't own the crypto either. Best and safest thing is to hold 100% of it on your personal cold wallet, after you have transferred it from those exchanges. Binance is a much better exchange in my personal opinion as Coinbase stole 1 Ethereum from me, I've read people lose more on it but nonetheless it's all subjective. Maybe they don't treat US clients as bad. On Coinbase it's much easier to buy crypto tho since it doesn't have such a confusing UI like Binance.",True,1,
Brand new to crypto,I consider coinbase a bit more user friendly and intuitive if that's an important characteristic for you,True,1,
Brand new to crypto,Take a look at SwissBorg[Beginner’s Guide](https://zarniwoop.info/learn-crypto),True,1,
Brand new to crypto,"You do not own your crypto on any exchange. But that is a good thing. They are more motivated to make sure Noone hacks or steals the crypto. When it goes to a wallet or off exchange , one mistake and POOF....ITS GONE.",True,1,
Brand new to crypto,"Coinbase and Binance are both solid choices for beginners since you can actually buy, sell, and withdraw your crypto to your own wallet. Revolut is different  you don’t truly own the crypto there because you can’t send it to an external wallet, only cash it out back into money. A cold wallet like a Ledger or Trezor isn’t a must right away, but it’s the safest way to store your coins long-term. If you plan to hold a decent amount, it’s worth getting one sooner rather than later.",True,1,
Crypto independence,"..a Sunday quick question. I've been reading on various financial websites that there's going to be a mini-market crash soon...🙂‍↔️However, even if that were completely false, why should cryptocurrencies follow the various micro and macroeconomic trends? 🤔Aren't cryptocurrencies also designed to be a decentralized currency, independent of official currencies?Why, just as happened during the last spot wars, as I call them, did BTC, for example, fall and then rise again after the war?🤳🏻 Indeed, precisely because BTC has its own logic, it should have a completely independent trend, as if it were in a parallel world, where all possibilities are present. Can someone explain this to me? Thank all and sorry for my poor English 🥹",False,0,
Keep track of cryptos,"I am very new to the cryptocurrency market and to investment in general, and I have been buying without keeping a record without knowing how much price I have bought and without knowing the profit or losses I have had, so in the future this could be a problem to declare my investments. I am from Colombia, and lately I have thought about selling when the price has risen (sell at profit) my investment is still very small, so I would sell, I would withdraw my money to Fiat, I would open a new account in another exchange that I have not used and I would start Keep an Excel spreadsheet with all the date data, purchase price, etc.

What do you do for this, I know that later on you will also pay a person to help organize all this but the truth is I have it back 💩 I don't know what I have done and the Binance statements are 💩 I can't manage any of this, are there reliable applications that you recommend to organize the portfolio?",False,4,Sentiment
Keep track of cryptos,"Write everything down, before you do it, use a calculator just to double check, make up your own table, show expenses and what your plan is. 
Buy low, sell high.",True,2,Sentiment
Keep track of cryptos,Do you at least know how much fiat you transferred in to buy? You can do a rough estimate by what you bought with ans what you took out as your gain/loss,True,1,Sentiment
Should I buy VET,With the current bullish market we are in. I am curious if I should invest in Vechain at this time. Looking at the history in the last month the highest was almost .029 and with a low of .0217 we are in the middle. Thinking of jumping on this before it goes anywhere. I know someone is going to say I am late but we can’t all get the cream of the crop and have to pick up scraps. Thanks for the info,False,7,Sentiment
Should I buy VET,You’re definitely not late on VET. It’s not up much from its bottom. Whether or not that makes it a good investment or not is questionable. I’m still holding mine.,True,11,Sentiment
Should I buy VET,"VET has had a large spike in price every bull run thus far. It climbs fast and then dumps fast.
Will this bull be any different? Maybe.
Last cycle I threw a few grand into it, it payed off well. I did the same this cycle. I will be 100% out at .06 though.",True,4,Sentiment
