title,selftext,is_comment,score,flair
Do i buy now?,"LoL a redditor misreading the tariffs classic.

NO ONE KNOWS. The best time to buy is always 5 years ago. Dollar cost average in, & accept you will likely be slaughtered.",True,1,Discussion
Do i buy now?,Yeah load up - price is no object - everything is gonna 10x its a sure thing /s,True,0,Discussion
Do I Share My Biggest Crypto Regret?,"I’ve made some really solid picks over the years and had some great wins in crypto. But I’ll be honest, I also made what feels like one seriously bad investment. It’s the kind that sticks with you because I genuinely believed in the project and its potential, but it just has not delivered.

I’ve been debating whether to share more details. Part of me worries that calling it out could hurt the project even more, especially if it is already in trouble. On the other hand, maybe talking about it could help others learn from it or avoid a similar mistake.

What do you think? Is it worth sharing, or should I just move on and chalk it up to experience?",False,33,STRATEGY
Do I Share My Biggest Crypto Regret?,"Share it, lol. One voice on reddit won't crash a good project.

I invested into like 6 altcoins that failed horribly. Varying from $100-1000 investments.

And I sold 2 bitcoin when they were $400.

Currently down 90% on Zerebro and and IO. I imagine now would be a good time to buy some alts before the real takeoff - when alts have dominance. They don't yet.",True,23,STRATEGY
Do I Share My Biggest Crypto Regret?,My biggest regret is putting 10k into crypto when BTC was between 5500-10k and somehow not being a whole coiner. I lost close to half of that initial investment on bitgrail 🙃,True,6,STRATEGY
Do I Share My Biggest Crypto Regret?,"Over the last year : SUI is up 461.4% BGB 362.7%, XRP 354.6%, HBAR 353.5%, WBT 304.8%, XLM 276%, AAVE 157.3%, TRX 156.2%, GT 135.7%, ENA 120.3%, ADA 118.8%, ALGO 118.4%, DOGE 106.5%, LTC 99.3% 
- - -
BTC 97.2%
- - - 
CRO 76.5%, XMR 74.5%, LINK 72.6%, BCH 71.2%, FTN 70.6%, UNI 67.1%, MNT 64.6%, RSETH 56.9%, WBETH 56.7%, BNB 52.2%, ETH 51.6%, LEO 47.2%, ONDO 39.6%, PEPE 35.9%, TAO 31.9%, BONK 23%, SEI 19%, SOL 8.9%

Curious if your project is on this list…",True,7,STRATEGY
Do I Share My Biggest Crypto Regret?,"I’m guessing LRC (Loopring)

It’s sinking like a stone regardless.",True,3,STRATEGY
Do I Share My Biggest Crypto Regret?,"And mine's Tron, and Matic, and Vet, and Bitconeeect before that.  

Simply move on and focus on the King for peace of mind.",True,3,STRATEGY
Do I Share My Biggest Crypto Regret?,"My biggest regret was buying Safemoon before the hype pump and not selling when I had 9x, I became greedy and I sold when it dropped again to less than 2x instead.

Later that project died completely.",True,3,STRATEGY
Do I Share My Biggest Crypto Regret?,"Crypto is immature.
Its not good for investment especially alts 
You can make millions by thousands with proper risk reward management.
You can not get anywhere without proper psychology, discipline and mindset",True,3,STRATEGY
Do I Share My Biggest Crypto Regret?,if you’ve only made one bad investment in crypto you’re not trying hard enough,True,2,STRATEGY
Do I Share My Biggest Crypto Regret?,Share it. You never know in some random corner of Reddit the names picks up and then the coin picks up!,True,2,STRATEGY
Do I Share My Biggest Crypto Regret?,For me it's RUNE..,True,2,STRATEGY
Do I Share My Biggest Crypto Regret?,Did you buy $TRUMP at the top?,True,4,STRATEGY
Do I Share My Biggest Crypto Regret?,Following,True,1,STRATEGY
Do I Share My Biggest Crypto Regret?,"I started trading meme coins and that was a huge mistake.  I didnt lose much but I learned not to do that again.  Saying that, I do have a little in MANYU which is kinda moving up.  Everything else is in BTC, ETH, SOL and XRP",True,1,STRATEGY
Do I Share My Biggest Crypto Regret?,I bought Tezos at its ICO with 2 bitcoin lol. If only I had held the btc instead....,True,1,STRATEGY
Do I Share My Biggest Crypto Regret?,Share!! :-),True,1,STRATEGY
Do I Share My Biggest Crypto Regret?,"Lost thousands to LRC. Took me 4 years to get back into profit.

All I'm trying to say is you're definitely not alone 😅",True,1,STRATEGY
Do I Share My Biggest Crypto Regret?,"I bought Electroneum, that’s pretty regrettable.",True,1,STRATEGY
Do I Share My Biggest Crypto Regret?,"How long ago did you make this investment, no names needed to be mentioned, also did you make a lump sum initial investment & not DCA since? I’m curious to know more about the situation without hearing any names. I’m wanting to learn more about why you regret the investment, was it because you see growth in other assets, and feel like you could have invested there instead? If you choose to let the name of the asset be known maybe it will make you feel better. At the end of the day one shouldn’t live with regret, there’s far more to life than money.",True,1,STRATEGY
Do I Share My Biggest Crypto Regret?,I hopped on the luna hype train 💀,True,1,STRATEGY
Do I Share My Biggest Crypto Regret?,[deleted],True,1,STRATEGY
Do I Share My Biggest Crypto Regret?,"I wonder if he bought GRT, it's been completely dead for four years now... Imagine buying it for two dollars back in 2021 then four years later it's under ten cents...",True,1,STRATEGY
Do I Share My Biggest Crypto Regret?,I'll tell you about my best investment first :) BNB at 36.00. That's what started the whole thing,True,1,STRATEGY
Do I Share My Biggest Crypto Regret?,ICP?,True,1,STRATEGY
Do I Share My Biggest Crypto Regret?,Star Atlas?,True,1,STRATEGY
Do I Share My Biggest Crypto Regret?,I panic sold one time.,True,1,STRATEGY
Do I Share My Biggest Crypto Regret?,I had a 10x on polygon and didn't sell. Now I'm sitting about even and regret not selling in 2021. Always take profits.,True,1,STRATEGY
Do I Share My Biggest Crypto Regret?,"My biggest one? Not sticking to just BTC, because that one has just grown and grown and grown. The rest...what in the shittin' hell have they really done for me, financially?

I know that I could have easily secured 50 BTC (maybe more) without any huge problems. Today I would be millionaire.

But I'm not. My second biggest regret is not getting into Ethereum in 2015 when it was basically worth less than $1 per token. I could have easily secured 2000-3000 of those.

The clock never turns back. The hands of time are irreversible. Life is best understood backwards, but it must be lived forwards.",True,1,STRATEGY
Do I Share My Biggest Crypto Regret?,I sold 2.2m Doge at .003¢,True,1,STRATEGY
Do I Share My Biggest Crypto Regret?,"We’ve all been there.
Selling the one that moons hours after you sold it and keeping the one that drains your gains…i love it…it’s fantastic.",True,1,STRATEGY
Do I Share My Biggest Crypto Regret?,"Probably bought jasmy when it was fresh and was gonna be the Japanese Bitcoin. Then it dumped 90% 😂

It was my first investment, luckily I only put in $200.",True,1,STRATEGY
Do I Share My Biggest Crypto Regret?,"Share, you telling your experience don't affect a coin to much if any degree.",True,1,STRATEGY
Do I Share My Biggest Crypto Regret?,[The full story here.](https://www.reddit.com/r/CryptoMarkets/s/r49FU2dFXh),True,1,STRATEGY
Do I Share My Biggest Crypto Regret?,It seems the full story was taken down.. Not sure why it doesn't say anything.. Annoying,True,1,STRATEGY
Do I Share My Biggest Crypto Regret?,Man I thought it was Xcn or Swftc lol I’m down bad on those,True,1,STRATEGY
Do I Share My Biggest Crypto Regret?,"I think you should share it.Your experience could help others avoid making the same mistake.As long as you keep it respectful and constructive,it doesnt have to hurt the project.It might even serve as useful feedback.Everyone makes bad calls sometimes,but talking about them helps the whole community learn.",True,1,STRATEGY
Do I Share My Biggest Crypto Regret?,Sui,True,0,STRATEGY
Do I Share My Biggest Crypto Regret?,DOT?,True,0,STRATEGY
Do I Share My Biggest Crypto Regret?,"OK Guys, my biggest mistake was defenitely investing in THETA and TFUEL. I really had seen a bunch of decent names working on some next Gen ideas. I normally DCA on the way down but I was new to the game and it just kept going up.. So I kept buying.......  

I think the last bag I purchased was around 14.00 and the ATH was around 16. Now my initial bag was bought at around 0.30! And just like that. Poof like a fart in the wind. Is it my fault; Absolutely. I was so caught up in the hype it was going to hit 25-30-100 even. So when it corrected, I held.. And corrected some more. And I held. and the  within a very short period of like a week it really fell.   I didn't take profits at all because now I was 80% in the hole and it has to recover some, no? [Insert crypto laughing at me here]

So those buys all the way up are still red and the one big initial bag is still the only thing green but doesn't come come close to fixing the death pit I dug myself into. Having said that I still want to believe in their work but my own experience with their support and the nearly complete lack of PR and an official way to reach them is really insane for being this far along. 

This is of course not the big letter I wrote.. Thats a LOT longer and I will make a new post about it next.. 

This smaller version is so everyone here now know what my biggest fail was. I would like to hear from anyone with experience with this token and running their nodes. I still run their node because it's the only thing that gives back some tfuel however I feel at this point my electricity and my hardware is  handing money over fist to theta labs. Disappointed",True,0,STRATEGY
"Why I’m Still Interested in Crypto, Even with All the Noise","Not financial advice, just a personal take

A few years ago, crypto felt like the Wild West. It was full of promise, chaos, scams, and moonshots. While some of that is still true today, there is a shift happening in 2025 that feels different. The level of involvement by governments and major corporations is growing, and that says a lot.

We’re now seeing regular headlines about central banks exploring or launching digital currencies. Tech giants are integrating crypto wallets, and financial institutions like BlackRock, Visa, and Fidelity are quietly building products tied to blockchain and tokenized assets. What was once niche is starting to look like infrastructure.

That doesn’t mean everything is safe or guaranteed. Governments have a long history of twisting innovations to serve their own interests. There’s always the risk of overregulation, surveillance, or centralization of power under the guise of innovation. Public blockchains and decentralization are powerful ideas, but they’re not immune to being co-opted.

Still, the fact that governments and corporations are building anything at all on this tech should not be ignored. It shows that the core concepts behind crypto have staying power. Whether it’s used for payments, identity, or new financial products, blockchain is becoming part of the future.

I’m not telling you to buy anything. I’m not saying to gamble your savings. What I am saying is that it’s worth paying attention. Because this is no longer about just a few coins and online forums. This is about the future of money, data, and power. Knowing what’s coming gives you a better chance of understanding the changes that will affect all of us.

Not financial advice. Just a reminder to stay aware, keep learning, and think critically.",False,3,SENTIMENT
"Why I’m Still Interested in Crypto, Even with All the Noise",I wrote a much longer version now.. I may delete this lol will see,True,1,SENTIMENT
"BTC holding steady is good, right?","Why does it feel like we’re all just hanging out in the waiting room of a dentist’s office…
Something big better happen soon or we might actually go touch grass.
",False,10,DISCUSSION
"BTC holding steady is good, right?","Btc.d going down is good, regardless of price",True,1,DISCUSSION
"BTC holding steady is good, right?","its better than it being down when you hold innit.
BTC always goes sideways after big move",True,1,DISCUSSION
"BTC holding steady is good, right?",[removed],True,-1,DISCUSSION
Trezor,"Can you swap your coins directly on trezor to usdc? 
If I wanted to hold any coin compatible with trezor (sol for example) if I’m ready to take profits can I just directly swap it for USDC right in trezor suite? Or is there any reason I need to have a phantom wallet or send back to centralized exchange. TIA. ",False,3,
Best Hot Wallet For Temporary Storage,"So I currently have some crypto on an exchange and I want to keep it easily accessible incase I want to sell or swap some in the near future. I have a cold storage wallet but I will be traveling a lot and don't have a computer with me often. Normally I would just store it in there and send out if I wanted to sell but since that won't really work for me in the near future I want to know what the next best option is. 

I was thinking of a hot wallet since it's a little safer than an exchange, plus I've heard ppl have problems with some exchanges taking their money/coins. If you recommend a hot wallet what are the best ones for the U.S. Or let me know if there is a better option to temporarily store some of my coins, I will prolly only need to do this for 2-4 months. ",False,1,EXCHANGE
Best Hot Wallet For Temporary Storage,"Phantom, Metamask, Base",True,1,EXCHANGE
Passive income in crypto?,"
Hey everyone,

I just made a new video on YouTube on passively earning ETH through a process that involves automatically helping with Ethereum blockchain transactions. This isn’t about mining, staking, or trading bots in the traditional sense. It’s something a bit different and much more hands off. No MEV bot nonsense

The idea is pretty simple ..Whenever transactions happen on the Ethereum blockchain, there are opportunities to capture small profits from transaction fees. Normally, those go to miners or validators, but with some tools and the right setup, there are ways for regular users to tap into those same opportunities. My video walks you through how this works, what the risks are.

I came across this method while researching passive crypto income ideas that don’t rely on price speculation or complex trading strategies or even trading bots. A lot of content out there focuses on staking or yield farming, but this is more about participating in the network itself in a semi automated way. It’s especially useful for people who want to accumulate ETH slowly over time without actively trading or managing positions every day.

One of the best things about this method is that it can run in the background. Once it’s set up, it doesn’t require a lot of effort to maintain. Of course, there are some important things to keep in mind, like understanding gas fees, timing, and making sure your setup is safe and efficient. 

The video is meant for beginners as well as people who already understand a bit about how Ethereum works. I try to break things down step by step so you can decide if this is something worth trying for yourself. It’s not a get rich quick thing!

Here’s the link to the video if you want to check it out: [https://youtu.be/ciZ-_-4fqW8?si=JlUC2RzvJEYOWU_-]

I’d love to hear your thoughts if you try this method or have any experience with similar strategies, definitely let me know. I’m always open to improving the content and sharing other ideas in future videos.
 ",False,0,STRATEGY
Passive income in crypto?,Scam,True,3,STRATEGY
Passive income in crypto?,"I don't know how others feel, but to me this looks to be risky as hell. I would only consider it if I could fully review the source code, say via a github link, but otherwise I  am going to stay far away and urge others to do the same. 

This falls under the *if it looks too good to be true* as well as *no internet stranger is trying to make you rich* rubrics.",True,1,STRATEGY
Eth or Sol?,"Hey guys, I'm new to this and still learning but i got a $100 in my wallet already just sitting there. Would it be good to buy n leave some eth or Sol or maybe BTC, while i learn? 

If so what would be the good prices to buy? ",False,15,Discussion
Eth or Sol?,Wallstreet chose ETH as their go-to blockchain. I'm copytrading their bet,True,48,Discussion
Eth or Sol?,ETH no question... SOL is centralized VC garbage downtime galore,True,16,Discussion
Eth or Sol?,"You HAVE to buy ETH to do anything anyway , right ?",True,12,Discussion
Eth or Sol?,Eth,True,17,Discussion
Eth or Sol?,"Yikes.

SOL is a meme chain and not suitable for anything with serious financial implications.

The chain often goes down.
It is a centralized service.
When it goes down, it's literally a Discord chat popularity contest to decide what block to roll the chain back to.

Stay away from SOL.
It is for suckers, hoping other suckers jump in to provide exit liquidity. 



Ethereum, on the other hand, is an exceptional investment, especially if you stake it.  

Or you can buy and hold Rocketpool rETH instead.  This would allow you to essentially earn yield on your ETH, but does open up potential for smart contract risk.   If that's too worrying, just buy ETH to hold",True,11,Discussion
Eth or Sol?,Institutional money is going all in on ETH. If you hate money buy SOL.,True,8,Discussion
Eth or Sol?,Get both,True,3,Discussion
Eth or Sol?,ETH is always a good option and rn I'm stacking up some more so I can earn on it at nexo,True,2,Discussion
Eth or Sol?,Ethereum will always have an advantage because it's the first mover. Solana will always have an advantage because of it's geographical location. Split it. And then set up a DCA auto-buy and split that as well.,True,1,Discussion
Eth or Sol?,ARB>,True,1,Discussion
Eth or Sol?,"absolutely solana dude. its the memecoin capital of the world. Even ""Trump"" token is on solana. Everyone also knows its just way more powerful and faster than ETH. Ethereum is being cannabalized by the layer 2's it spawned, when in reality, we just need a very strong L1. Solana is that answer!",True,1,Discussion
Eth or Sol?,ETH imo its my next investment once I hit my hbar and dovu targets,True,1,Discussion
Eth or Sol?,Algorand,True,1,Discussion
Eth or Sol?,HBAR,True,1,Discussion
Eth or Sol?,Eth (but actually Link),True,1,Discussion
Eth or Sol?,Both,True,1,Discussion
Eth or Sol?,"ETH.

SOL went up too fast too soon. It's not lost its momentum where as other alts are likely to gain momentum.",True,1,Discussion
Eth or Sol?,Btc,True,-1,Discussion
Eth or Sol?,Ada,True,0,Discussion
Eth or Sol?,Bitcoin,True,-5,Discussion
Eth or Sol?,Sol is faster and cheaper.,True,-6,Discussion
Eth or Sol?,$50 in BTC $25 in ETH and $25 in Sol. Good to go. 👍🏻,True,-3,Discussion
Eth or Sol?,sol looks cheaper rn but eth more safe long term,True,0,Discussion
Eth or Sol?,Both. That being said I am like 9:1 weighted eth,True,0,Discussion
Eth or Sol?,I do 80% BTC / 10% Sol / 10% Eth,True,0,Discussion
Eth or Sol?,"BTC y ETH, y si quieres algo mas de riego SOL o XRP pero en menor proporción",True,-1,Discussion
Eth or Sol?,50% btc for years. The rest splitted between the 2.,True,-1,Discussion
Eth or Sol?,ETH and NEXO,True,-2,Discussion
Eth or Sol?,Btc,True,-6,Discussion
Eth or Sol?,"Both. Sol will get the degen investors who like to gamble on their chain. Some of Sols degen activity might get rotated into SUI.

Eth has large institutional investors. They trust it more. 

As far as competition with BTC or atleast keeping pace Sol/Eth are the only two cryptos that have that massive onchain engagement, people are actually using them. alot of others like Avax, Xrp, and ADA dont get that kind of attention on their chains they are more speculative assets relying on tech.",True,-1,Discussion
Eth or Sol?,Neither. Just focus on Bitcoin.,True,-1,Discussion
Eth or Sol?,Algorand,True,-8,Discussion
Eth or Sol?,SPX6900,True,-10,Discussion
Eth or Sol?,Xrp,True,-10,Discussion
Eth or Sol?,"you're buying at a good time. I like SOL a lot more than ETH just because of gas fees, but also the ETH community is better than SOL. 

It's really your personal preference. DYOR.",True,-2,Discussion
Eth or Sol?,"Gspot, buy it with sol. Easiest decision I made I’m up thousands of dollars in over a week.",True,-3,Discussion
Eth or Sol?,NEXO,True,-6,Discussion
Eth or Sol?,XRP,True,-6,Discussion
Trump-Backed World Liberty Financial ($WLFI) Launches Points Program to Reward $USD1 Users! 🚀,"Big news from the Trump-affiliated DeFi project World Liberty Financial ($WLFI)! They just announced a new Points Program to incentivize users for engaging with their platform, specifically for trading, holding, staking, and using their USD1 stablecoin. 🤑  

$WLFI is the governance token for the platform, which raised a massive $550M through token sales, and $USD1 is their dollar-pegged stablecoin with a market cap already at $2.19B, making it the fifth-largest stablecoin. 😮 


What do you all think? Is this a legit DeFi play, or just another Trump-branded hype machine? 🤔 And with the Genius Act and stablecoin regulations in the works, could $USD1 become a major player?",False,1,
"I am given $2,000 to trade crypto, what do I do?","Hey everyone. I'm 16. As mentioned, someone gave me $2,000 to trade crypto. I have no idea how to trade, nor do I have any experience with crypto whatsoever. But I really need to deliver some positive results. I don't want to ruin this opportunity and disappoint them. What would you have done if you were in my shoes?",False,10,Support-Open
"I am given $2,000 to trade crypto, what do I do?",You will definitely lose it if you're completely new to crypto trading,True,41,Support-Open
"I am given $2,000 to trade crypto, what do I do?","Don't trade, from 2k, put 1900 in bitcoin and keep the rest to buy yourself a hard wallet.


And come back in 10 years to thanks me. ",True,23,Support-Open
"I am given $2,000 to trade crypto, what do I do?",Return the money back to the person who owns it and only play with your own money that you are willing to lose.,True,23,Support-Open
"I am given $2,000 to trade crypto, what do I do?","Translation: I am broke. I saved up 2k and I want to be day trader and get rich. Give easy advice.

Who would give 16yo 2k to trade crypto who has no experience in trading...",True,6,Support-Open
"I am given $2,000 to trade crypto, what do I do?","Better skip trading if you want to keep 
your money. Look into spx6900 and hold.",True,3,Support-Open
"I am given $2,000 to trade crypto, what do I do?","start with demo account(where you dont need to use your money) and learn through some good youtube videos.  
Dont rush, and dont  gamble with full amount, just start with 100$",True,11,Support-Open
"I am given $2,000 to trade crypto, what do I do?",Buy bitcoin and hold it for 10+ years. Look up how to store it securely offline. ,True,11,Support-Open
"I am given $2,000 to trade crypto, what do I do?",buy btc and dca,True,2,Support-Open
"I am given $2,000 to trade crypto, what do I do?",DCA,True,2,Support-Open
"I am given $2,000 to trade crypto, what do I do?","I've been involved in crypto since 2015.

I dont know how you got this ""opportunity"" but it's not what you think it is. Someone had ""paid"" you $2000 to do something you do not know how to do and you really want to be successful. It sounds like you are asking how to make more money by 'trading crypto' not holding crypto. Day trading is one of the most brutal, unforgiving, and complex industry out there. You do not want to get involved with it from a place of having zero knowledge. 

If you are serious, and you want to turn this $2000 into $2000+ your best bet is a combination of staking and holding. Trading will absolutely get you rekt. 

A very important step here will be framing your expectations. If you are hoping to turn this $2000 into more than $3000 you need to understand that, if that was easy, more people will be doing it. If you understand you can use crypto as an inflation hedge and hope to earn more than the 3-5% growth traditional investments would yield, you will have a much better time with the results you can realistically expect. 

Good luck.",True,2,Support-Open
"I am given $2,000 to trade crypto, what do I do?","Buy $1000 xrp, and $500 Hbar and $500 XLM. Good spread each has $1000/token potential in 5-10 years maybe more…and for god sakes don’t sell until you see each at 4 digits. DONT EVEN THINK ABOUT IT!!!",True,2,Support-Open
"I am given $2,000 to trade crypto, what do I do?","RN, buy the BTC dip...HODL...Then take out $2K of your original investment & use the rest to trade..So even if you lose, you only lose the profits & not the capital.",True,1,Support-Open
"I am given $2,000 to trade crypto, what do I do?","Yeahhhhh you don't wanna trade crypto if you're new. Google swing trading if you're dead set on ""trading"" you get a bit more control on your trades. Crypto really is a casino imo",True,1,Support-Open
"I am given $2,000 to trade crypto, what do I do?",Check out BLAST. It’s on coinbase or you can buy in the app but they’re building an awesome product.,True,1,Support-Open
"I am given $2,000 to trade crypto, what do I do?","What i would say is get as much education as possible before you really take the plunge. There's also the emotional aspect to trading that also needs to be kept in check. Even after that, start with BTC and ETH. I did that before finally going deep into altcoins such as RENDER, TAO, LINK, AIOZ.",True,1,Support-Open
"I am given $2,000 to trade crypto, what do I do?",[removed],True,1,Support-Open
